id,text1,text2
1,"Photosynthesis is the biochemical process by which plants use chlorophyll to convert light energy, carbon dioxide, and water into glucose and oxygen.","Plants use sunlight, air, and water to make their own food, and they release oxygen for us to breathe."
2,"The heart is a muscular organ that circulates blood through the pulmonary and systemic vascular systems by rhythmic contraction.","The heart is a strong pump that pushes blood around your body."
3,"The Pythagorean theorem states that, in a right triangle, the square of the hypotenuse equals the sum of the squares of the other two sides.","For a triangle with one square corner, the longest side squared equals the other two sides squared and added together."
4,"Evaporation occurs when molecules at the surface of a liquid gain sufficient kinetic energy to transition into the gaseous state.","Evaporation happens when liquid gets enough energy to turn into a gas, like a puddle drying in the sun."
5,"Earth's rotation is its approximately 24-hour spin around its axis, producing the cycle of day and night.","Earth spins around once each day, so your side faces the Sun during daytime and turns away at night."
